{
  "alg": "Ed25519",
  "kid": "contract-test-1",
  "payload": "eyJmdXR1cmVfc2VjdGlvbiI6IHsieCI6IDF9LCAiaXNzdWVkX2F0IjogIjIwMjYtMTAtMDFUMTI6MDA6MDBaIiwgImtpZCI6ICJjb250cmFjdC10ZXN0LTEiLCAibm90aWNlcyI6IFt7ImZ1dHVyZV9maWVsZCI6IHRydWUsICJpZCI6ICJhY3RpdmUiLCAibWVzc2FnZSI6ICJBY3RpdmUgbm93LiIsICJzZXZlcml0eSI6ICJpbmZvIn1dLCAic2NoZW1hX3ZlcnNpb24iOiAxLCAic2VxdWVuY2UiOiA4LCAidmVyc2lvbnMiOiB7ImRlc2t0b3AiOiB7ImxhdGVzdCI6ICIyLjAuMCIsICJtaW5pbXVtX3N1cHBvcnRlZCI6ICIxLjAuMCJ9LCAicGlwIjogeyJsYXRlc3QiOiAiMi4wLjAiLCAibWluaW11bV9zdXBwb3J0ZWQiOiAiMS4wLjAifX19",
  "sig": "9lFTfI9lMYYdEOQrZXc1nBn3XVYaPnIBSCZLzE7XSgIdy99Erlioinlod2SuscFPwEHhHdlxhPXxnpr-R9MbDw"
}
