{
  "alg": "Ed25519",
  "kid": "test-pol-534200f601ad1487",
  "payload": "eyJhZGRvbnMiOiBbeyJkZXNjcmlwdGlvbiI6ICJSZWFkcyBQREYgZmlsZXMsIHdpdGggT0NSIGZvciBzY2FubmVkIHBhZ2VzLiIsICJpZCI6ICJwZGYiLCAia2luZCI6ICJmaWxlLXR5cGUiLCAibGFiZWwiOiAiUERGIiwgImxpY2VuY2UiOiAiZnJlZSIsICJzdGF0dXMiOiAiYXZhaWxhYmxlIiwgInN1bW1hcnkiOiAiUmVhZCBQREYgZmlsZXMuIn0sIHsiYnVuZGxlcyI6IFsib2ZmaWNlIl0sICJpZCI6ICJkb2N4IiwgImtpbmQiOiAiZmlsZS10eXBlIiwgImxhYmVsIjogIldvcmQgZG9jdW1lbnRzIiwgImxpY2VuY2UiOiAibGljZW5zZWQiLCAic3VtbWFyeSI6ICJSZWFkIC5kb2N4IGZpbGVzLiIsICJ0cmFuc2xhdGlvbnMiOiB7ImVzIjogeyJsYWJlbCI6ICJEb2N1bWVudG9zIGRlIFdvcmQifX19LCB7ImlkIjogInNlbWFudGljIiwgImxhYmVsIjogIlNlbWFudGljIHNlYXJjaCIsICJyZXF1ZXN0X3VybCI6ICJodHRwczovL2V4YW1wbGUudGVzdC9zZW1hbnRpYyIsICJzdGF0dXMiOiAiY29taW5nX3Nvb24iLCAic3VtbWFyeSI6ICJGaW5kIHBhZ2VzIGJ5IG1lYW5pbmcuIn1dLCAiYnVuZGxlcyI6IFt7ImFkZG9ucyI6IFsiZG9jeCJdLCAiaWQiOiAib2ZmaWNlIiwgImxhYmVsIjogIk9mZmljZSIsICJzdW1tYXJ5IjogIldvcmQsIEV4Y2VsIGFuZCBQb3dlclBvaW50LiJ9XSwgImlzc3VlZF9hdCI6ICIyMDI2LTEwLTAxVDEyOjAwOjAwWiIsICJraWQiOiAidGVzdC1wb2wtNTM0MjAwZjYwMWFkMTQ4NyIsICJyZXF1ZXN0X3VybCI6ICJodHRwczovL2V4YW1wbGUudGVzdC9yZXF1ZXN0IiwgInNjaGVtYV92ZXJzaW9uIjogMSwgInNlcXVlbmNlIjogNX0",
  "sig": "S-8fDTlTPdgYjxYdb9a6YshpuRJUrbyGXNu0UJLTUs1Z6rdDsVnUZgkDjxK9lfOSiusAUOqalXKoMWtBEYAXDw"
}
