{
  "alg": "Ed25519",
  "kid": "test-pol-534200f601ad1487",
  "payload": "eyJhZGRvbnMiOiBbeyJkZXNjcmlwdGlvbiI6ICJSZWFkcyBQREYgZmlsZXMsIHdpdGggT0NSIGZvciBzY2FubmVkIHBhZ2VzLiIsICJmdXR1cmVfZmllbGQiOiB0cnVlLCAiaWQiOiAicGRmIiwgImtpbmQiOiAiZmlsZS10eXBlIiwgImxhYmVsIjogIlBERiIsICJsaWNlbmNlIjogImZyZWUiLCAic3RhdHVzIjogImF2YWlsYWJsZSIsICJzdW1tYXJ5IjogIlJlYWQgUERGIGZpbGVzLiJ9LCB7ImJ1bmRsZXMiOiBbIm9mZmljZSJdLCAiaWQiOiAiZG9jeCIsICJraW5kIjogImZpbGUtdHlwZSIsICJsYWJlbCI6ICJXb3JkIGRvY3VtZW50cyIsICJsaWNlbmNlIjogImxpY2Vuc2VkIiwgInN1bW1hcnkiOiAiUmVhZCAuZG9jeCBmaWxlcy4iLCAidHJhbnNsYXRpb25zIjogeyJlcyI6IHsibGFiZWwiOiAiRG9jdW1lbnRvcyBkZSBXb3JkIn19fSwgeyJpZCI6ICJzZW1hbnRpYyIsICJsYWJlbCI6ICJTZW1hbnRpYyBzZWFyY2giLCAicmVxdWVzdF91cmwiOiAiaHR0cHM6Ly9leGFtcGxlLnRlc3Qvc2VtYW50aWMiLCAic3RhdHVzIjogImNvbWluZ19zb29uIiwgInN1bW1hcnkiOiAiRmluZCBwYWdlcyBieSBtZWFuaW5nLiJ9XSwgImJ1bmRsZXMiOiBbeyJhZGRvbnMiOiBbImRvY3giXSwgImlkIjogIm9mZmljZSIsICJsYWJlbCI6ICJPZmZpY2UiLCAic3VtbWFyeSI6ICJXb3JkLCBFeGNlbCBhbmQgUG93ZXJQb2ludC4ifV0sICJmdXR1cmVfc2VjdGlvbiI6IHsieCI6IDF9LCAiaXNzdWVkX2F0IjogIjIwMjYtMTAtMDFUMTI6MDA6MDBaIiwgImtpZCI6ICJ0ZXN0LXBvbC01MzQyMDBmNjAxYWQxNDg3IiwgInJlcXVlc3RfdXJsIjogImh0dHBzOi8vZXhhbXBsZS50ZXN0L3JlcXVlc3QiLCAic2NoZW1hX3ZlcnNpb24iOiAxLCAic2VxdWVuY2UiOiA4fQ",
  "sig": "17wJP-2KoyevMNeOl1BGqJdKsaxe_pNLvlRCDkMgLEFKcFp3OCz45pBhO--e5HsCmkB09pL4mD014OMXeBSICA"
}
