{
  "alg": "Ed25519",
  "kid": "example-1",
  "payload": "eyJzY2hlbWFfdmVyc2lvbiI6MSwic2VxdWVuY2UiOjEsImlzc3VlZF9hdCI6IjIwMjYtMTAtMDhUMTI6MDA6MDBaIiwia2lkIjoiZXhhbXBsZS0xIiwidmVyc2lvbnMiOnsiZGVza3RvcCI6eyJsYXRlc3QiOiIxLjAuMCIsIm1pbmltdW1fc3VwcG9ydGVkIjoiMS4wLjAifSwicGlwIjp7ImxhdGVzdCI6IjEuMC4wIiwibWluaW11bV9zdXBwb3J0ZWQiOiIxLjAuMCJ9fX0",
  "sig": "AAAAAAAAAAAAAAAAAAAAAAAAAAAAAAAAAAAAAAAAAAAAAAAAAAAAAAAAAAAAAAAAAAAAAAAAAAAAAAAAAAAAAA"
}
