{
  "alg": "Ed25519",
  "kid": "test-pst-77e47eeec8f013b8",
  "payload": "eyJpc3N1ZWRfYXQiOiAiMjAyNi0xMC0wMVQxMjowMDowMFoiLCAia2lkIjogInRlc3QtcHN0LTc3ZTQ3ZWVlYzhmMDEzYjgiLCAicmV2b2tlZF9rZXlfaWRzIjogWyJ0ZXN0LXBvbC01MzQyMDBmNjAxYWQxNDg3Il0sICJzY2hlbWFfdmVyc2lvbiI6IDEsICJzZXF1ZW5jZSI6IDIwLCAidmVyc2lvbnMiOiB7ImRlc2t0b3AiOiB7ImxhdGVzdCI6ICIyLjAuMCIsICJtaW5pbXVtX3N1cHBvcnRlZCI6ICIxLjAuMCJ9LCAicGlwIjogeyJsYXRlc3QiOiAiMi4wLjAiLCAibWluaW11bV9zdXBwb3J0ZWQiOiAiMS4wLjAifX19",
  "sig": "G8rtcP4Za66GX5WQolU2sQ3B5H7PK1SJ9bTTG0pXEqJ2eO1vSYKmwJcXEUOPJK5c1tBmKaSDunSVI8Ce7CD1DQ"
}
