{
  "alg": "Ed25519",
  "kid": "contract-test-1",
  "payload": "eyJpc3N1ZWRfYXQiOiAiMjAyNi0xMC0wMVQxMjowMDowMFoiLCAia2lkIjogImNvbnRyYWN0LXRlc3QtMSIsICJub3RpY2VzIjogW3siaWQiOiAiYWN0aXZlIiwgIm1lc3NhZ2UiOiAiQWN0aXZlIG5vdy4iLCAic2V2ZXJpdHkiOiAiaW5mbyJ9LCB7ImVuZHNfYXQiOiAiMjAyMC0wMS0wMlQwMDowMDowMFoiLCAiaWQiOiAiZXhwaXJlZCIsICJtZXNzYWdlIjogIk92ZXIuIiwgInNldmVyaXR5IjogImluZm8iLCAic3RhcnRzX2F0IjogIjIwMjAtMDEtMDFUMDA6MDA6MDBaIn0sIHsiaWQiOiAiZnV0dXJlIiwgIm1lc3NhZ2UiOiAiTm90IHlldC4iLCAic2V2ZXJpdHkiOiAid2FybmluZyIsICJzdGFydHNfYXQiOiAiMjA5OS0wMS0wMVQwMDowMDowMFoifV0sICJzY2hlbWFfdmVyc2lvbiI6IDEsICJzZXF1ZW5jZSI6IDUsICJ2ZXJzaW9ucyI6IHsiZGVza3RvcCI6IHsibGF0ZXN0IjogIjIuMC4wIiwgIm1pbmltdW1fc3VwcG9ydGVkIjogIjEuMC4wIn0sICJwaXAiOiB7ImxhdGVzdCI6ICIyLjAuMCIsICJtaW5pbXVtX3N1cHBvcnRlZCI6ICIxLjAuMCJ9fX0",
  "sig": "-nkCZ7G4o4UlwzWNv9eT4IBlINVijttKaANaeBI2uj9_u3SpVvrhmxgQ3UqvseKL5iQquozqvNTI625v9SIrAA"
}
