{
  "alg": "Ed25519",
  "kid": "test-pst-77e47eeec8f013b8",
  "payload": "eyJpc3N1ZWRfYXQiOiAiMjAyNi0xMC0wMVQxMjowMDowMFoiLCAia2lkIjogInRlc3QtcHN0LTc3ZTQ3ZWVlYzhmMDEzYjgiLCAicmV2b2tlZF9rZXlfaWRzIjogWyJ0ZXN0LXBzdC03N2U0N2VlZWM4ZjAxM2I4IiwgInRlc3QtbGljLTAwMDAwMDAwMDAwMDAwYWEiXSwgInNjaGVtYV92ZXJzaW9uIjogMSwgInNlcXVlbmNlIjogMjEsICJ2ZXJzaW9ucyI6IHsiZGVza3RvcCI6IHsibGF0ZXN0IjogIjIuMC4wIiwgIm1pbmltdW1fc3VwcG9ydGVkIjogIjEuMC4wIn0sICJwaXAiOiB7ImxhdGVzdCI6ICIyLjAuMCIsICJtaW5pbXVtX3N1cHBvcnRlZCI6ICIxLjAuMCJ9fX0",
  "sig": "pEONHvXS857xhHkPVsmHLoLIOxXCVx1pqe7p2_XqqABoSiaq1lNiurmwNRX5u5X6Q3pJG5i2g6UfpR-K_tmHBQ"
}
