{
  "alg": "Ed25519",
  "kid": "test-pol-534200f601ad1487",
  "payload": "eyJpc3N1ZWRfYXQiOiAiMjAyNi0xMC0wMVQxMjowMDowMFoiLCAia2lkIjogInRlc3QtcG9sLTUzNDIwMGY2MDFhZDE0ODciLCAibm90aWNlcyI6IFt7ImlkIjogImFjdGl2ZSIsICJtZXNzYWdlIjogIkFjdGl2ZSBub3cuIiwgInNldmVyaXR5IjogImluZm8ifSwgeyJlbmRzX2F0IjogIjIwMjAtMDEtMDJUMDA6MDA6MDBaIiwgImlkIjogImV4cGlyZWQiLCAibWVzc2FnZSI6ICJPdmVyLiIsICJzZXZlcml0eSI6ICJpbmZvIiwgInN0YXJ0c19hdCI6ICIyMDIwLTAxLTAxVDAwOjAwOjAwWiJ9LCB7ImlkIjogImZ1dHVyZSIsICJtZXNzYWdlIjogIk5vdCB5ZXQuIiwgInNldmVyaXR5IjogIndhcm5pbmciLCAic3RhcnRzX2F0IjogIjIwOTktMDEtMDFUMDA6MDA6MDBaIn1dLCAic2NoZW1hX3ZlcnNpb24iOiAxLCAic2VxdWVuY2UiOiA2LCAidmVyc2lvbnMiOiB7ImRlc2t0b3AiOiB7ImxhdGVzdCI6ICIyLjAuMCIsICJtaW5pbXVtX3N1cHBvcnRlZCI6ICIxLjAuMCJ9LCAicGlwIjogeyJsYXRlc3QiOiAiMi4wLjAiLCAibWluaW11bV9zdXBwb3J0ZWQiOiAiMS4wLjAifX19",
  "sig": "HtV8FlaAAi7GG1s8L15w4xKXDI3-ji-1kuO9jDr9MbLjNIXIxfGA4obAeDORjIAqX-BWoKYgJ4fPnS-QFkDJAQ"
}
