{
  "alg": "Ed25519",
  "kid": "test-pol-534200f601ad1487",
  "payload": "eyJpc3N1ZWRfYXQiOiAiMjAyNi0xMC0wMVQxMjowMDowMFoiLCAia2lkIjogInRlc3QtcG9sLTUzNDIwMGY2MDFhZDE0ODciLCAicmV2b2tlZF9rZXlfaWRzIjogWyJ0ZXN0LWxpYy0wMDAwMDAwMDAwMDAwMGFhIl0sICJzY2hlbWFfdmVyc2lvbiI6IDEsICJzZXF1ZW5jZSI6IDcsICJ2ZXJzaW9ucyI6IHsiZGVza3RvcCI6IHsibGF0ZXN0IjogIjIuMC4wIiwgIm1pbmltdW1fc3VwcG9ydGVkIjogIjEuMC4wIn0sICJwaXAiOiB7ImxhdGVzdCI6ICIyLjAuMCIsICJtaW5pbXVtX3N1cHBvcnRlZCI6ICIxLjAuMCJ9fX0",
  "sig": "ERdZb6YCEuIto0HXxC2YvyD_Jioj8OdQLE0kYf3hohN5FW6Zm4t_iA3FXFtk6GbxXCBumg5Anhtz4PlWu9gmBA"
}
