{
  "alg": "Ed25519",
  "kid": "test-pol-534200f601ad1487",
  "payload": "eyJpc3N1ZWRfYXQiOiAiMjAyNi0xMC0wMVQxMjowMDowMFoiLCAia2lkIjogInRlc3QtcG9sLTUzNDIwMGY2MDFhZDE0ODciLCAic2NoZW1hX3ZlcnNpb24iOiAyLCAic2VxdWVuY2UiOiA5LCAidmVyc2lvbnMiOiB7ImRlc2t0b3AiOiB7ImxhdGVzdCI6ICIyLjAuMCIsICJtaW5pbXVtX3N1cHBvcnRlZCI6ICIxLjAuMCJ9LCAicGlwIjogeyJsYXRlc3QiOiAiMi4wLjAiLCAibWluaW11bV9zdXBwb3J0ZWQiOiAiMS4wLjAifX19",
  "sig": "dJduwXH2vqOdvTHtraXWuu_N9834DOD-hVtbunEwRHnDnuvKmpNMoaYF4rz194WQ03rVM1LKsSbsAk4X8aEjBg"
}
